{
    "$schema": "./run.schema.json",
    "group": "witcher",
    "name": "witcher_3000kp",
    "video": "res/videos/witcher_320p.y4m",
    "colorspace": "ycbcr420",
    "quality_metric": "psnr",
    "training": {
        "precision": 16,
        "scheduler": {
            "name": "saliout",
            "learning_rate": "primus"
        },
        "optimizer": "adamo",
        "loss": "iron",
        "take_best": true,
        "batch_size": 16,
        "topology": {
            "builder": "aurora_quant2_mp",
            "parameters": [3.0]
        },
        "gradient_clipping": 1.0
    },
    "packer": "foo",
    "quantization": {
        "method": "dozer"
    }
}